request_id,original_text,text_output,detected_language,budget_amount,business_unit,category_l1,category_l2,contract_type_requested,country,created_at,currency,data_residency_constraint,delivery_countries,esg_requirement,incumbent_supplier,preferred_supplier_mentioned,quantity,request_channel,request_language,request_text,requester_id,requester_role,required_by_date,scenario_tags,site,status,submitted_for_id,title,unit_of_measure,heuristic_anomalies
REQ-000001,Need 400 consulting days of IT project management support starting next month. Delivery required by 2026-05-17. Budget is approximately 400 000.00 EUR. Prefer Accenture Advisory Europe if commercially competitive.,Need 400 consulting days of IT project management support starting next month. Delivery required by 2026-05-17. Budget is approximately 400 000.00 EUR. Prefer Accenture Advisory Europe if commercially competitive.,English,400000.0,Digital Workplace,Professional Services,IT Project Management Services,purchase,ES,2026-04-14T10:33:00Z,EUR,False,,False,,Accenture Advisory Europe,400,teams,en,Need 400 consulting days of IT project management support starting next month. Delivery required by 2026-05-17. Budget is approximately 400 000.00 EUR. Prefer Accenture Advisory Europe if commercially competitive.,USR-3001,Workplace Lead,2026-05-17,standard,Madrid,new,USR-8001,IT project management request,consulting days,MISSING: Delivery countries not specified.
REQ-000002,Need cloud compute capacity estimated at 120000 instance hours per month. Please move quickly. Budget should stay near 14 400.00 EUR. We would like to stay with Azure Enterprise if possible.,Need cloud compute capacity estimated at 120000 instance hours per month. Please move quickly. Budget should stay near 14 400.00 EUR. We would like to stay with Azure Enterprise if possible.,English,14400,Regional IT EU,IT,Cloud Compute,framework call-off,NL,2026-04-13T15:22:00Z,EUR,False,,True,,Azure Enterprise,120000,portal,en,Need cloud compute capacity estimated at 120000 instance hours per month. Please move quickly. Budget should stay near 14 400.00 EUR. We would like to stay with Azure Enterprise if possible.,USR-3002,Infrastructure Manager,,missing_info,Amsterdam,new,USR-8002,Cloud compute capacity request,instance hours per month,MISSING: Delivery countries not specified.
REQ-000003,Need managed cloud platform service for 24 months. This is a larger sourcing wave with total budget around 1 320 000.00 EUR. Delivery by 2026-05-14. Please advise on quotes and approval path.,Need managed cloud platform service for 24 months. This is a larger sourcing wave with total budget around 1 320 000.00 EUR. Delivery by 2026-05-14. Please advise on quotes and approval path.,English,1320000,Regional IT EU,IT,Managed Cloud Platform Services,framework call-off,FR,2026-04-08T15:42:00Z,EUR,False,,True,,,,teams,fr,Need managed cloud platform service for 24 months. This is a larger sourcing wave with total budget around 1 320 000.00 EUR. Delivery by 2026-05-14. Please advise on quotes and approval path.,USR-3003,Infrastructure Manager,2026-05-14,threshold,Paris,new,USR-8003,Managed platform service sourcing,,MISSING: Quantity is not specified. | MISSING: Delivery countries not specified.
REQ-000004,Need 240 docking stations matching existing laptop fleet. Must be delivered by 2026-03-20 with premium specification. Budget capped at 25 199.55 EUR. Please use Dell Enterprise Europe with no exception.,Need 240 docking stations matching existing laptop fleet. Must be delivered by 2026-03-20 with premium specification. Budget capped at 25 199.55 EUR. Please use Dell Enterprise Europe with no exception.,English,25199.55,Digital Workplace,IT,Docking Stations,purchase,DE,2026-03-14T17:55:00Z,EUR,False,,False,,Dell Enterprise Europe,240,teams,en,Need 240 docking stations matching existing laptop fleet. Must be delivered by 2026-03-20 with premium specification. Budget capped at 25 199.55 EUR. Please use Dell Enterprise Europe with no exception.,USR-3004,Workplace Lead,2026-03-20,contradictory,Berlin,pending_review,USR-8004,Docking station purchase,units,MISSING: Delivery countries not specified. | CONTRADICTION (POLICY): Requester explicitly refuses policy exceptions ('no exception').
REQ-000005,Need 50 desktop workstations for design and data teams. Delivery required by 2026-06-03. Budget is approximately 120 000.00 EUR.,Need 50 desktop workstations for design and data teams. Delivery required by 2026-06-03. Budget is approximately 120 000.00 EUR.,English,120000.0,Data & Analytics,IT,Desktop Workstations,purchase,DE,2026-03-27T08:01:00Z,EUR,False,,False,,,50,teams,de,Need 50 desktop workstations for design and data teams. Delivery required by 2026-06-03. Budget is approximately 120 000.00 EUR.,USR-3005,Workplace Lead,2026-06-03,standard,Hamburg,new,USR-8005,High-performance desktop workstation order,desktop workstations,MISSING: Delivery countries not specified.
